{
  "$schema": "https://raw.githubusercontent.com/cobia68/pi-onward/main/onward.schema.json",
  "enabled": true,
  "action": "message",
  "prompt": "继续",
  "maxRetries": 10,
  "maxSameError": 10,
  "delay": "3s..15s",
  "rules": [
    {
      "name": "quota",
      "when": {
        "error": "insufficient[\\s_-]*quota|exceeded your current quota|quota exceeded|out of budget|billing|usage limit|余额不足|额度不足|额度已用尽"
      },
      "action": "stop"
    },
    {
      "name": "context-overflow",
      "when": {
        "error": "context[\\s_-]*(length|window)|prompt (is )?too long|maximum context|request_too_large"
      },
      "action": "stop"
    },
    {
      "name": "auth",
      "when": {
        "error": "\\b401\\b|unauthorized|authentication|invalid[\\s_-]*(x-)?(api[\\s_-]*)?(key|token)"
      },
      "action": "resend",
      "maxRetries": 20,
      "delay": "3s..10s"
    },
    {
      "name": "rate-limit",
      "when": {
        "error": "\\b429\\b|rate[\\s_-]*limit|too many requests|resource[\\s_-]*exhausted"
      },
      "action": "resend",
      "maxRetries": 5,
      "delay": "30s,1m,2m"
    },
    {
      "name": "server",
      "when": {
        "error": "\\b(500|502|503|504|520|524|529)\\b|overloaded|server[\\s_-]*error|internal[\\s_-]*error|bad gateway|service[\\s_-]*unavailable|upstream|负载已饱和"
      },
      "action": "resend"
    },
    {
      "name": "network",
      "when": {
        "error": "connection|network|econnreset|econnrefused|etimedout|socket hang up|fetch failed|timed? ?out|terminated"
      },
      "action": "resend"
    },
    {
      "name": "empty",
      "when": {
        "empty": true
      },
      "action": "message",
      "maxRetries": 3
    },
    {
      "name": "fallback",
      "action": "message",
      "prompt": "上一步出错了（{error}），接着做",
      "maxRetries": 3,
      "maxSameError": 2
    }
  ]
}
